{"schema_version":"0.1","record_id":"FREP-001","repository_id":1317741101,"repository":"seantmyers4-source/FederationOS","owner":"seantmyers4-source","visibility":"public","default_branch":"main","canonical_status":"candidate-not-designated","directive":"FED-CC-RMD-FREP-001-001","verification":"OSF-REP-VER-003"}